<?xml version="1.0" encoding="UTF-8"?>
<!-- edited with XMLSpy v2015 sp1 (x64) (http://www.altova.com) by Chenfeng Zhu (TU Clausthal, Institut für Informatik) -->
<MyWorld xmlns:xsi="http://www.w3.org/2001/XMLSchema-instance" xmlns="http://tuc.de/zhuchenfeng" xsi:schemaLocation="http://tuc.de/zhuchenfeng wheretogo.xsd">
    <!-- Only one Agency - WhereToGo for now.-->
    <Agency Agencyname="WhereToGo">
        <!-- P1 -->
        <Production>
            <Title keyword="true">Movie Week</Title>
            <Description keyword="true">The whole week!</Description>
            <Website>
                <Official>http://www.movieweek.com</Official>
                <Trailer>http://www.adtrailer.com/agency/wtg/movieweek</Trailer>
            </Website>
            <Session>
                <Venue venueid="456001"/>
                <Startdate keyword="true">2015-04-15</Startdate>
                <Starttime>20:30:00</Starttime>
            </Session>
            <Session>
                <Venue venueid="123001"/>
                <Startdate keyword="true">2015-04-16</Startdate>
                <Starttime>20:00:00</Starttime>
            </Session>
            <Session>
                <Venue venueid="123001"/>
                <Startdate keyword="true">2015-04-17</Startdate>
                <Starttime>19:00:00</Starttime>
            </Session>
            <ProductionKind>
                <KindName keyword="true">Movie</KindName>
                <Name>Tom and Jerry</Name>
                <Movie>
                    <Director keyword="true">Tom</Director>
                    <Cast>
                        <Actor keyword="true">Jerry</Actor>
                    </Cast>
                </Movie>
            </ProductionKind>
            <Feedback>
                <Review>This movie is wonderful.</Review>
                <Rating>5</Rating>
            </Feedback>
            <Feedback>
                <Review>This movie is good.</Review>
            </Feedback>
            <Feedback>
                <Rating>5</Rating>
            </Feedback>
        </Production>
        <!-- P2 -->
        <Production>
            <Title keyword="true">Movie April</Title>
            <Description keyword="true">Movie in April.</Description>
            <Website>
                <Official>http://www.movieapirl.com</Official>
            </Website>
            <Session>
                <Venue venueid="456001"/>
                <Startdate keyword="true">2015-04-15</Startdate>
                <Starttime>20:00:00</Starttime>
            </Session>
            <ProductionKind>
                <KindName keyword="true">Movie</KindName>
                <Name>Lego</Name>
                <Movie>
                    <Director>Rose</Director>
                    <Cast>
                        <Actor>Will</Actor>
                    </Cast>
                </Movie>
            </ProductionKind>
        </Production>
        <!-- P3 -->
        <Production>
            <Title keyword="true">Musical Weekend</Title>
            <Description keyword="true">Musical at Weekend.</Description>
            <Website>
                <Trailer>http://www.trailer.com/agency/wtg/movieweekend</Trailer>
            </Website>
            <Session>
                <Venue venueid="456001"/>
                <Startdate keyword="true">2015-03-07</Startdate>
                <Starttime>19:30:00</Starttime>
            </Session>
            <Session>
                <Venue venueid="456001"/>
                <Startdate keyword="true">2015-03-08</Startdate>
                <Starttime>19:30:00</Starttime>
            </Session>
            <ProductionKind>
                <KindName keyword="true">Musical</KindName>
                <Musical/>
            </ProductionKind>
        </Production>
        <!-- P4 -->
        <Production>
            <Title keyword="true">Concert April</Title>
            <Description keyword="true">Concert in April.</Description>
            <Website/>
            <Session>
                <Venue venueid="123002"/>
                <Startdate keyword="true">2015-04-17</Startdate>
                <Starttime>20:00:00</Starttime>
            </Session>
            <ProductionKind>
                <KindName keyword="true">Concert</KindName>
                <Concert/>
            </ProductionKind>
        </Production>
        <!-- P5 -->
        <Production>
            <Title keyword="true">TheatrePlay April</Title>
            <Description keyword="true">TheatrePlay in April.</Description>
            <Website/>
            <Session>
                <Venue venueid="789001"/>
                <Startdate keyword="true">2015-04-10</Startdate>
                <Starttime>19:30:00</Starttime>
            </Session>
            <Session>
                <Venue venueid="456002"/>
                <Startdate keyword="true">2015-04-15</Startdate>
                <Starttime>19:00:00</Starttime>
            </Session>
            <ProductionKind>
                <KindName keyword="true">TheatrePlay</KindName>
                <TheatrePlay/>
            </ProductionKind>
        </Production>
        <!-- P5 -->
        <Production>
            <Title keyword="true">Special TheatrePlay</Title>
            <Description keyword="true">Special TheatrePlay in the morning.</Description>
            <Website/>
            <Session>
                <Venue venueid="456002"/>
                <Startdate keyword="true">2015-04-15</Startdate>
                <Starttime>09:30:00</Starttime>
            </Session>
            <ProductionKind>
                <KindName keyword="true">TheatrePlay</KindName>
                <TheatrePlay/>
            </ProductionKind>
        </Production>
    </Agency>
    <!-- City List -->
    <City>
        <CityName keyword="true">Clausthal-Zellerfeld</CityName>
        <Venue venueid="123001">
            <VenueName>Kronenplatz</VenueName>
            <VenueAddress>Kronenplatz 3, 38678 Clausthal-Zellerfeld</VenueAddress>
            <VenueContact>0049 17612345678</VenueContact>
        </Venue>
        <Venue venueid="123002">
            <VenueName>IZC</VenueName>
            <VenueAddress>International Center Clausthal, Graupenstraße 11, 38678 Clausthal-Zellerfeld</VenueAddress>
            <VenueContact>0049 17612345678</VenueContact>
            <Website>http://www.tu-clausthal.de</Website>
        </Venue>
        <Venue venueid="123003">
            <VenueName>CLZ_ZOB</VenueName>
            <VenueAddress>ZOB, Clausthal-Zellerfeld</VenueAddress>
            <VenueContact>0049 17612345678</VenueContact>
        </Venue>
    </City>
    <City>
        <CityName keyword="true">Goslar</CityName>
        <Venue venueid="456001">
            <VenueName>Goslar_ZOB</VenueName>
            <VenueAddress>Klubgartenstraße 12, 38640 Goslar</VenueAddress>
            <VenueContact>0049 17612345678</VenueContact>
        </Venue>
        <Venue venueid="456002">
            <VenueName>Goslarer_Theater</VenueName>
            <VenueAddress>Breite Straße 86, 38640 Goslar</VenueAddress>
            <VenueContact>0049 17612345678</VenueContact>
            <VenueType>Theatre</VenueType>
            <Website>http://www.goslarertheater.com</Website>
        </Venue>
    </City>
    <City>
        <CityName keyword="true">Hannover</CityName>
        <Venue venueid="789001">
            <VenueName>HannoverHbf</VenueName>
            <VenueAddress>Niki-de-Saint-Phalle-Promenade 17, 30159 Hannover</VenueAddress>
            <VenueContact>0049 17612345678</VenueContact>
        </Venue>
        <Venue venueid="789002">
            <VenueName>HannoverFlughafen</VenueName>
            <VenueAddress>Flughafenstraße 4, 30855 Langenhagen, Hannover</VenueAddress>
            <VenueContact>0049 17612345678</VenueContact>
        </Venue>
    </City>
</MyWorld>
